id,title,date,url
NDTV-2622966,"In Letter To 13 States, Centre Raises Concern Over Fall In Covid Testing Rates",2021-11-24T00:00:00+05:30,https://www.ndtv.com/india-news/in-letter-to-13-states-centre-raises-concern-over-fall-in-covid-19-testing-rates-2622966
NDTV-2622671,"India&#039;s COVID-19 Vaccination Coverage Exceeds 118.44 Crore",2021-11-24T00:00:00+05:30,https://www.ndtv.com/india-news/coronavirus-indias-covid-19-vaccination-coverage-exceeds-118-44-crore-2622671
NDTV-2622527,"9,283 Fresh Covid Cases In India, 22% Higher Than Yesterday",2021-11-24T00:00:00+05:30,https://www.ndtv.com/india-news/coronavirus-9-283-fresh-covid-cases-in-india-22-higher-than-yesterday-2622527
NDTV-2622486,"Covaxin 50% Effective Against Covid, Less Than Initially Thought: Lancet",2021-11-24T00:00:00+05:30,https://www.ndtv.com/india-news/covaxin-was-only-50-per-cent-effective-during-delta-wave-shows-real-world-study-2622486
NDTV-2622370,"Covaxin 50% Effective When Delta Was Dominant, Shows Lancet Study",2021-11-24T00:00:00+05:30,https://www.ndtv.com/india-news/coronavirus-covaxin-50-effective-when-delta-was-dominant-shows-lancet-study-2622370
NDTV-2622361,"Coronavirus LIVE Updates: India Reports 9,283 New Covid Cases In Last 24 Hours",2021-11-24T00:00:00+05:30,https://www.ndtv.com/india-news/coronavirus-india-live-updates-india-reported-7-579-new-covid-19-cases-236-deaths-on-tuesday-2622361
NDTV-2621712,"Four Army Officers, Fully Vaccinated, Test Covid Positive In Indore",2021-11-23T00:00:00+05:30,https://www.ndtv.com/india-news/madhya-pradesh-four-army-officers-fully-vaccinated-test-covid-positive-in-indore-2621712
NDTV-2621358,"In Maharashtra District, This Is Penalty For Not Taking 1st Vaccine Shot",2021-11-23T00:00:00+05:30,https://www.ndtv.com/india-news/coronavirus-in-maharashtras-aurangabad-district-this-is-penalty-for-not-taking-1st-vaccine-shot-2621358
NDTV-2621171,"7,579 New COVID-19 Cases In India, Lowest Daily Rise In 18 Months",2021-11-23T00:00:00+05:30,https://www.ndtv.com/india-news/coronavirus-7-579-new-covid-19-cases-in-india-lowest-since-may-last-year-2621171
NDTV-2621066,"Coronavirus India Highlights: 7,579 New COVID-19 Cases In India",2021-11-24T00:00:00+05:30,https://www.ndtv.com/india-news/coronavirus-india-live-updates-8-488-new-covid-19-cases-in-india-2621066
NDTV-2621009,"Supreme Court Seeks Data On Compensation Paid To Families Of Covid Dead",2021-11-23T00:00:00+05:30,https://www.ndtv.com/india-news/supreme-court-seeks-data-on-compensation-paid-to-families-of-covid-dead-2621009
NDTV-2620177,"Covaxin Cleared By UK, Relief For Indian Students And Tourists",2021-11-22T00:00:00+05:30,https://www.ndtv.com/india-news/covaxin-cleared-by-uk-relief-for-indian-students-and-tourists-2620177
NDTV-2620163,"Launch &quot;Aggressive&quot; Jab Campaign: Health Minister Directs These 3 States",2021-11-22T00:00:00+05:30,https://www.ndtv.com/india-news/health-minister-mansukh-mandaviya-coronavirus-vaccine-covid-vaccine-launch-aggressive-jab-campaign-health-minister-directs-these-2-states-2620163
NDTV-2620136,"Booster Shots For India? Not Yet, Say Experts: Report",2021-11-22T00:00:00+05:30,https://www.ndtv.com/india-news/covid-19-booster-shots-for-india-not-yet-say-experts-report-2620136
NDTV-2619886,"8,488 New COVID-19 Cases In India, Lowest Since May Last Year",2021-11-22T00:00:00+05:30,https://www.ndtv.com/india-news/coronavirus-8-488-new-covid-19-cases-in-india-lowest-since-may-last-year-2619886
NDTV-2619863,"Health Minister To Review Progress Of COVID-19 Vaccination Campaign Today",2021-11-22T00:00:00+05:30,https://www.ndtv.com/india-news/health-minister-mansukh-mandaviya-to-review-progress-of-covid-19-vaccination-campaign-today-2619863
NDTV-2619775,"Coronavirus India Highlights: 8,488 New COVID-19 Cases In India, Lowest Since May Last Year",2021-11-23T00:00:00+05:30,https://www.ndtv.com/india-news/coronavirus-india-live-updates-10-488-new-covid-cases-in-india-2619775
NDTV-2618991,"10,488 New COVID-19 Cases In India, 186 More Than Yesterday",2021-11-21T00:00:00+05:30,https://www.ndtv.com/india-news/coronavirus-10-488-new-covid-19-cases-in-india-186-more-than-yesterday-2618991
NDTV-2618913,"Coronavirus India Highlights: 10,488 New COVID-19 Cases In India, 186 More Than Yesterday",2021-11-22T00:00:00+05:30,https://www.ndtv.com/india-news/coronavirus-india-live-updates-10-302-new-covid-19-cases-in-india-2618913
NDTV-2618279,"Gujarat Covid Patient Discharged After 202 Days Of Hospitalisation",2021-11-20T00:00:00+05:30,https://www.ndtv.com/india-news/gujarat-covid-19-patient-dicharged-after-202-days-of-hospitalisation-2618279
NDTV-2618096,"India Logs 10,302 New Covid Cases Today, Active Cases Decline To 1,24,868",2021-11-20T00:00:00+05:30,https://www.ndtv.com/india-news/india-logs-10-302-new-covid-cases-today-active-cases-decline-to-1-24-868-2618096
NDTV-2617974,"Coronavirus India Highlights: 10,302 New COVID-19 Cases In India, 7% Lower Than Yesterday",2021-11-21T00:00:00+05:30,https://www.ndtv.com/india-news/coronavirus-india-live-updates-11-106-covid-cases-in-india-2617974
NDTV-2617098,"&quot;Those Who Drink Don&#039;t Lie&quot;: Madhya Pradesh Official&#039;s Odd Vaccine Logic",2021-11-19T00:00:00+05:30,https://www.ndtv.com/india-news/madhya-pradesh-khandwa-official-on-vaccination-rule-those-who-drink-dont-lie-2617098
NDTV-2616612,"Coronavirus India Highlights: 11,106 Fresh COVID-19 Cases In India, 7% Lower Than Yesterday",2021-11-20T00:00:00+05:30,https://www.ndtv.com/india-news/coronavirus-india-live-updates-indias-covid-vaccination-coverage-crosses-115-crore-mark-says-union-health-minister-mansukh-mandaviya-2616612
NDTV-2615450,"Why Top Drugmaker Is Surprisingly Downbeat About Covid Pill, Sputnik Shot",2021-11-18T00:00:00+05:30,https://www.ndtv.com/india-news/dont-see-covid-pills-as-driver-of-profit-says-merck-partner-dr-reddys-2615450
NDTV-2615363,"India Reports 11,919 New Covid Cases In Last 24 Hours, 470 Deaths",2021-11-18T00:00:00+05:30,https://www.ndtv.com/india-news/india-reports-11-919-new-covid-19-cases-in-last-24-hours-470-deaths-2615363
NDTV-2615232,"1 In 3 New Students Hasn&#039;t Seen Physical Classes Due To Covid: Report",2021-11-18T00:00:00+05:30,https://www.ndtv.com/india-news/1-in-3-new-students-hasnt-seen-physical-classes-due-to-covid-report-2615232
NDTV-2615222,"Coronavirus India Highlights: 11,919 New COVID-19 Cases In India",2021-11-19T00:00:00+05:30,https://www.ndtv.com/india-news/https-www-ndtv-com-india-news-coronavirus-live-updates-covid-cases-on-18-november-cases-in-kerala-maharashtra-delhi-2615222
NDTV-2614986,"Covid Under Control, All Restrictions Withdrawn: Madhya Pradesh Chief Minister",2021-11-17T00:00:00+05:30,https://www.ndtv.com/india-news/covid-under-control-all-restrictions-withdrawn-madhya-pradesh-chief-minister-2614986
NDTV-2614223,"Actors Like Salman Khan Should Encourage Muslims For Covid Vaccination: Mumbai Mayor",2021-11-17T00:00:00+05:30,https://www.ndtv.com/india-news/actors-like-salman-khan-should-encourage-muslims-for-covid-19-vaccination-mumbai-mayor-kishori-pednekar-2614223
NDTV-2613897,"Maharashtra&#039;s Shirdi Temple Allows 10,000 More Devotees Per Day As Covid Cases Dip",2021-11-17T00:00:00+05:30,https://www.ndtv.com/india-news/maharashtras-shirdi-temple-allows-10-000-more-devotees-per-day-as-covid-cases-dip-2613897
NDTV-2613755,"Coronavirus India Live Updates: India Records 10,197 New COVID-19 Cases, 15% Higher Than Yesterday",2021-11-17T00:00:00+05:30,https://www.ndtv.com/india-news/coronavirus-india-live-updates-india-records-10-197-new-covid-19-cases-15-higher-than-yesterday-2613755
NDTV-2612971,"Stickers For Fully Jabbed? Health Minister&#039;s Suggestion To Increase Coverage",2021-11-16T00:00:00+05:30,https://www.ndtv.com/india-news/health-minister-mansukh-mandaviya-coronavirus-vaccine-covid-vaccine-stickers-for-fully-jabbed-health-ministers-suggestion-to-increase-coverage-2612971
NDTV-2612492,"8,865 Fresh COVID-19 Cases In India, Lowest In 287 Days",2021-11-16T00:00:00+05:30,https://www.ndtv.com/india-news/coronavirus-8-865-fresh-covid-19-cases-in-india-lowest-in-287-days-2612492
NDTV-2612399,"US Issues &#039;Level One&#039; Travel Health Notice For India",2021-11-17T00:00:00+05:30,https://www.ndtv.com/india-news/us-issues-level-one-travel-health-notice-for-india-2612399
NDTV-2612373,"Coronavirus India Live Updates: 8,865 Fresh COVID-19 Cases In India, Lowest In Over 9 Months",2021-11-16T00:00:00+05:30,https://www.ndtv.com/india-news/coronavirus-live-updates-covid-cases-on-16-november-cases-in-kerala-maharashtra-delhi-2612373
NDTV-2612020,"Europe, UK Continue To Remain In India&#039;s Covid &quot;At-Risk&quot; Air Traveller List",2021-11-15T00:00:00+05:30,https://www.ndtv.com/india-news/coronavirus-coronavirus-travel-europe-uk-continue-to-remain-in-indias-covid-at-risk-air-traveller-list-2612020
NDTV-2611106,"10,229 Fresh COVID-19 Cases In India, Lowest Daily Rise Since February: 10 Points",2021-11-15T00:00:00+05:30,https://www.ndtv.com/india-news/coronavirus-10-229-fresh-covid-19-cases-in-india-9-2-lower-than-yesterday-2611106
NDTV-2611036,"Coronavirus India Live Updates: 10,229 Fresh COVID-19 Cases In India, 9.2% Lower Than Yesterday",2021-11-15T00:00:00+05:30,https://www.ndtv.com/india-news/coronavirus-live-updates-covid-cases-on-15-november-cases-in-kerala-maharashtra-delhi-2611036
NDTV-2610228,"India Reports 11,271 COVID-19 Cases, Active Cases Lowest Since March 2020",2021-11-14T00:00:00+05:30,https://www.ndtv.com/india-news/coronavirus-india-reports-11-271-new-covid-19-cases-active-caseload-lowest-since-march-2020-2610228
NDTV-2610123,"Coronavirus LIVE Updates: 11,271 New Covid Cases In India, 4% Lower Than Yesterday",2021-11-14T00:00:00+05:30,https://www.ndtv.com/india-news/coronavirus-live-updates-covid-cases-on-14-november-cases-in-kerala-maharashtra-delhi-2610123
NDTV-2610036,"Mumbai Achieves 100% First Dose Covid Vaccination Target: Minister",2021-11-14T00:00:00+05:30,https://www.ndtv.com/india-news/mumbai-achieves-100-first-dose-covid-vaccination-target-minister-2610036
NDTV-2609182,"India Records 11,850 New COVID-19 Cases, 555 Deaths",2021-11-13T00:00:00+05:30,https://www.ndtv.com/india-news/coronavirus-india-records-11-850-new-covid-19-cases-555-deaths-2609182
NDTV-2609082,"Coronavirus LIVE Updates: 11,850 New Covid Cases In India, 5% Lower Than Yesterday",2021-11-13T00:00:00+05:30,https://www.ndtv.com/india-news/coronavirus-india-live-updates-over-3-44-crore-covid-cases-reported-in-india-so-far-4-62-lakh-deaths-2609082
NDTV-2609065,"Patients With Covid History Add To Diabetes Case Burden: Delhi Hospital",2021-11-13T00:00:00+05:30,https://www.ndtv.com/india-news/patients-with-covid-history-add-to-diabetes-case-burden-indraprastha-apollo-hospital-2609065
NDTV-2608817,"Parliamentary Panel Suggests Resuming International Passenger Flights",2021-11-12T00:00:00+05:30,https://www.ndtv.com/india-news/coronavirus-parliamentary-panel-suggests-resuming-international-passenger-flights-2608817
NDTV-2607840,"Covaxin 77.8% Effective Against Covid, Says Lancet Study",2021-11-12T00:00:00+05:30,https://www.ndtv.com/india-news/covaxin-efficacy-77-8-in-lancet-study-65-2-against-delta-in-early-data-2607840
NDTV-2607813,"12,516 Fresh Covid Cases In India, 4.3% Lower Than Yesterday",2021-11-12T00:00:00+05:30,https://www.ndtv.com/india-news/coronavirus-12-516-fresh-covid-19-cases-in-india-4-3-lower-than-yesterday-2607813
NDTV-2607756,"Covaxin Found To Be 77.8% Effective Against Covid In Lancet Study",2021-11-12T00:00:00+05:30,https://www.ndtv.com/india-news/coronavirus-covaxin-found-to-be-77-8-effective-against-covid-in-lancet-study-2607756
NDTV-2607712,"Coronavirus Highlights: India Reports 12,516 New Cases, 501 Deaths",2021-11-13T00:00:00+05:30,https://www.ndtv.com/india-news/coronavirus-india-live-updates-over-3-44-crore-covid-cases-reported-in-india-so-far-2607712
NDTV-2607672,"Mizoram Plans To Inoculate Myanmar Refugees Against Covid",2021-11-12T00:00:00+05:30,https://www.ndtv.com/india-news/mizoram-plans-to-inoculate-myanmar-refugees-against-covid-19-2607672
NDTV-2606531,"13,091 Fresh COVID-19 Cases In India, 14% Higher Than Yesterday: 10 points",2021-11-11T00:00:00+05:30,https://www.ndtv.com/india-news/coronavirus-13-091-fresh-covid-19-cases-in-india-14-higher-than-yesterday-2606531
NDTV-2606503,"&quot;Get Vaccine, Win TV&quot;: Maharashtra District&#039;s Offer In Fight Against Covid",2021-11-11T00:00:00+05:30,https://www.ndtv.com/india-news/maha-from-led-tvs-to-refrigerators-chandrapur-civic-body-offers-vaccination-incentives-2606503
NDTV-2606414,"Coronavirus Highlights: India Reports 13,091 New Cases, 340 Deaths In Last 24 Hours",2021-11-12T00:00:00+05:30,https://www.ndtv.com/india-news/coronavirus-india-live-updates-made-in-india-anti-covid-pills-could-be-cleared-for-use-in-days-2606414
NDTV-2606227,"UK Researchers Identify T-Cell Targets For Future Covid Vaccines",2021-11-11T00:00:00+05:30,https://www.ndtv.com/india-news/uk-researchers-identify-t-cell-targets-for-future-covid-vaccines-2606227
NDTV-2605154,"11,466 Fresh COVID-19 Cases In India, 13.2% Higher Than Yesterday: 10 Points",2021-11-10T00:00:00+05:30,https://www.ndtv.com/india-news/coronavirus-11-466-fresh-covid-19-cases-in-india-13-2-higher-than-yesterday-2605154
NDTV-2605104,"Covishield, Covaxin Recognised By 96 Countries, Says Health Minister",2021-11-10T00:00:00+05:30,https://www.ndtv.com/india-news/covid-19-vaccine-covishield-covaxin-recognised-by-96-countries-says-health-minister-mansukh-mandaviya-2605104
NDTV-2605069,"Coronavirus Highlights: Over 3.43 Crore Covid Cases In India So Far, 4.61 Lakh Deaths",2021-11-11T00:00:00+05:30,https://www.ndtv.com/india-news/coronavirus-india-live-updates-over-3-43-crore-covid-cases-in-india-so-far-4-61-lakh-deaths-2605069
NDTV-2603878,"10,126 Fresh Covid Cases In India, Lowest Daily Rise Since Early February: 10 Points",2021-11-09T00:00:00+05:30,https://www.ndtv.com/india-news/coronavirus-10-126-fresh-covid-19-cases-in-india-in-24-hours-lowest-single-day-rise-since-early-february-2603878
NDTV-2603745,"Coronavirus Highlights: India Reports 10,126 New Cases, 332 Deaths In Last 24 Hours",2021-11-10T00:00:00+05:30,https://www.ndtv.com/india-news/coronavirus-india-live-updates-over-3-63-crore-covid-cases-reported-in-india-so-far-2603745
NDTV-2602957,"Data Shows Drop In Daily Covid Vaccinations Over Last Few Months",2021-11-08T00:00:00+05:30,https://www.ndtv.com/india-news/data-shows-drop-in-daily-covid-vaccinations-over-last-few-months-2602957
NDTV-2602917,"2 Arrested For Running Hookah Cafe, Flouting Covid Rules In Delhi: Police",2021-11-08T00:00:00+05:30,https://www.ndtv.com/india-news/delhi-coronavirus-update-two-arrested-for-illegally-running-hookah-cafe-flouting-covid-rules-2602917
NDTV-2602615,"11,451 Fresh COVID-19 Cases In India, 5.5% Higher Than Yesterday: 10 Points",2021-11-08T00:00:00+05:30,https://www.ndtv.com/india-news/coronavirus-11-451-fresh-covid-19-cases-in-india-5-5-higher-than-yesterday-2602615
NDTV-2602527,"Coronavirus India Highlights: India Logs 11,451 New COVID-19 Cases, 266 Deaths",2021-11-09T00:00:00+05:30,https://www.ndtv.com/india-news/coronavirus-india-live-updates-india-reports-10-853-new-covid-cases-526-deaths-2602527
NDTV-2601882,"Over 15.77 Crore Balance Vaccine Doses Still Available With States: Centre",2021-11-07T00:00:00+05:30,https://www.ndtv.com/india-news/over-15-77-crore-balance-vaccine-doses-still-available-with-states-centre-2601882
NDTV-2601686,"10,853 Fresh Covid Cases In India, Marginally Lower Than Yesterday: 10 Points",2021-11-07T00:00:00+05:30,https://www.ndtv.com/india-news/coronavirus-10-853-fresh-covid-19-cases-in-india-in-last-24-hours-marginally-lower-than-yesterday-2601686
NDTV-2601622,"Coronavirus India Highlights: 10,853 New Covid Cases In India In Last 24 Hours, Marginally Lower Than Yesterday",2021-11-08T00:00:00+05:30,https://www.ndtv.com/india-news/coronavirus-india-live-updates-india-records-10-929-new-covid-19-cases-392-deaths-2601622
NDTV-2600803,"10,929 Fresh Covid Cases In India, 14% Lower Than Yesterday: 10 Points",2021-11-06T00:00:00+05:30,https://www.ndtv.com/india-news/coronavirus-10-929-fresh-covid-19-cases-in-india-14-14-lower-than-yesterday-2600803
NDTV-2600734,"Coronavirus India Highlights: India Records 10,929 New Covid Cases, 392 Deaths",2021-11-07T00:00:00+05:30,https://www.ndtv.com/india-news/coronavirus-india-live-updates-india-records-12-729-new-covid-cases-221-deaths-2600734
NDTV-2599794,"12,729 Fresh COVID-19 Cases In India, 1.2% Lower Than Yesterday",2021-11-05T00:00:00+05:30,https://www.ndtv.com/india-news/coronavirus-12-729-fresh-covid-19-cases-in-india-1-2-lower-than-yesterday-2599794
NDTV-2599760,"More Severe Covid In Indian Subcontinent May Be Blamed On Gene: Study",2021-11-05T00:00:00+05:30,https://www.ndtv.com/india-news/more-severe-covid-in-indian-subcontinent-may-be-blamed-on-gene-study-2599760
NDTV-2599691,"Coronavirus Highlights: India Records 12,729 New Covid Cases, 221 Deaths",2021-11-06T00:00:00+05:30,https://www.ndtv.com/india-news/coronavirus-india-live-updates-who-approves-bharat-biotechs-covaxin-for-emergency-use-2599691
NDTV-2599050,"12,885 New Covid Cases In India, Active Caseload Lowest In 253 Days",2021-11-04T00:00:00+05:30,https://www.ndtv.com/india-news/coronavirus-12-885-new-covid-19-cases-in-india-8-higher-than-yesterday-2599050
NDTV-2598953,"Coronavirus Live Highlights: India Records 12,885 New Covid Cases In 24 Hours",2021-11-05T00:00:00+05:30,https://www.ndtv.com/india-news/coronavirus-india-live-updates-who-approves-bharat-biotechs-covaxin-for-emergency-use-2598953
NDTV-2598573,"What Covaxin-Maker Bharat Biotech Said After WHO Approved India-Made Jab",2021-11-03T00:00:00+05:30,https://www.ndtv.com/india-news/what-covaxin-maker-bharat-biotech-said-after-who-approved-india-made-jab-2598573
NDTV-2598115,"&quot;Go Door-To-Door, Take Religious Leaders&#039; Help&quot;: PM On Vaccinations",2021-11-03T00:00:00+05:30,https://www.ndtv.com/india-news/coronavirus-pm-modi-tells-officials-flags-vaccine-complacency-focus-on-2nd-dose-2598115
NDTV-2598018,"PM Holds Meeting With Districts Having Low Covid Vaccination Coverage",2021-11-03T00:00:00+05:30,https://www.ndtv.com/india-news/coronavirus-pm-modi-holds-review-meeting-with-40-districts-on-low-covid-vaccination-coverage-2598018
NDTV-2597799,"11,903 New COVID-19 Cases In India, 14% Higher Than Yesterday",2021-11-03T00:00:00+05:30,https://www.ndtv.com/india-news/coronavirus-11-903-fresh-covid-19-cases-in-india-14-higher-than-yesterday-311-deaths-2597799
NDTV-2597690,"Coronavirus Highlights: WHO Approves Bharat Biotech&#039;s Covaxin For Emergency Use",2021-11-04T00:00:00+05:30,https://www.ndtv.com/india-news/coronavirus-india-live-updates-india-records-10-423-new-covid-cases-in-24-hours-2597690
NDTV-2596520,"10,423 New Covid Cases In India, Lowest Daily Rise Since Early February",2021-11-02T00:00:00+05:30,https://www.ndtv.com/india-news/coronavirus-10-423-fresh-covid-19-cases-in-india-lowest-daily-rise-since-second-week-of-february-2596520
NDTV-2596516,"PM To Review COVID-19 Vaccination In Districts With Low Coverage Tomorrow",2021-11-02T00:00:00+05:30,https://www.ndtv.com/india-news/pm-modi-to-review-covid-19-vaccination-in-districts-with-low-coverage-tomorrow-2596516
NDTV-2596401,"Coronavirus India Highlights: 10,423 New Covid Cases In Last 24 Hours; Lowest In 259 Days",2021-11-02T00:00:00+05:30,https://www.ndtv.com/india-news/coronavirus-india-live-updates-12-514-fresh-covid-19-cases-in-india-251-deaths-2596401
NDTV-2596010,"Five More Countries Recognise India&#039;s Covid Vaccination Certificate",2021-11-01T00:00:00+05:30,https://www.ndtv.com/india-news/five-more-countries-recognise-indias-covid-vaccination-certificate-2596010
NDTV-2595935,"Texas-India Vaccine Diplomacy Announces Covid Vaccine For $1.5 Per Dose",2021-11-01T00:00:00+05:30,https://www.ndtv.com/india-news/texas-india-vaccine-diplomacy-announces-covid-vaccine-for-1-5-per-dose-2595935
NDTV-2595313,"Active COVID-19 Cases Lowest In 248 Days",2021-11-01T00:00:00+05:30,https://www.ndtv.com/india-news/coronavirus-active-covid-19-cases-lowest-in-248-days-2595313
NDTV-2595295,"12,514 Fresh COVID-19 Cases In India, 2.4% Lower Than Yesterday",2021-11-01T00:00:00+05:30,https://www.ndtv.com/india-news/coronavirus-12-514-fresh-covid-19-cases-in-india-2-4-lower-than-yesterday-2595295
NDTV-2595213,"Coronavirus India Highlights: 12,514 Fresh COVID-19 Cases In India",2021-11-01T00:00:00+05:30,https://www.ndtv.com/india-news/coronavirus-india-live-updates-india-records-12-830-new-covid-cases-446-deaths-2595213
NDTV-2594467,"PM To Hold Review Meet This Week On Districts Having Low Vaccine Coverage",2021-10-31T00:00:00+05:30,https://www.ndtv.com/india-news/coronavirus-vaccination-pm-to-hold-review-meet-this-week-on-districts-having-low-vaccine-coverage-2594467
NDTV-2594236,"Coronavirus: 12,830 Fresh Covid Cases In India, 10% Lower Than Yesterday; 446 Deaths",2021-10-31T00:00:00+05:30,https://www.ndtv.com/india-news/coronavirus-12-830-fresh-covid-cases-in-india-10-lower-than-yesterday-446-deaths-2594236
NDTV-2594176,"Coronavirus India Highlights: India Records 12,830 Fresh Covid Cases, 446 Deaths",2021-10-31T00:00:00+05:30,https://www.ndtv.com/india-news/coronavirus-india-live-updates-india-records-14-313-fresh-covid-cases-549-related-deaths-2594176
NDTV-2593599,"Centre&#039;s Warning To Assam, Bengal As Covid Cases Rise, Tests Decline",2021-10-30T00:00:00+05:30,https://www.ndtv.com/india-news/coronavirus-centres-warning-to-assam-bengal-as-covid-cases-rise-tests-decline-2593599
NDTV-2593591,"Pope Francis Appreciates India&#039;s Aid To Countries During Covid Pandemic",2021-10-30T00:00:00+05:30,https://www.ndtv.com/india-news/pope-francis-appreciates-indias-assistance-to-countries-during-covid-pandemic-mea-2593591
NDTV-2593171,"Coronavirus India Highlights: India Records 14,313 New COVID-19 Cases",2021-10-31T00:00:00+05:30,https://www.ndtv.com/india-news/coronavirus-live-india-records-14-313-new-covid-19-cases-2593171
NDTV-2593133,"India Sees 14,313 Fresh Covid Cases, Kerala Adds To Death Count Backlog",2021-10-30T00:00:00+05:30,https://www.ndtv.com/india-news/coronavirus-14-313-fresh-coronavirus-cases-in-india-marginally-lower-than-yesterday-549-deaths-as-kerala-revises-data-2593133
NDTV-2593071,"Coronavirus India Highlights: India Sees 14,313 Fresh Covid Cases, Kerala Adds To Death Count Backlog",2021-10-30T00:00:00+05:30,https://www.ndtv.com/india-news/coronavirus-india-live-updates-14-348-new-covid-19-cases-in-india-2593071
NDTV-2591748,"Coronavirus India Highlights: 14,348 New COVID-19 Cases",2021-10-30T00:00:00+05:30,https://www.ndtv.com/india-news/coronavirus-india-live-updates-india-records-16-156-covid-19-cases-in-a-day-2591748
NDTV-2591229,"Hyderabad Firm Seeks Approval To Produce Generic Merck Covid Pill",2021-10-28T00:00:00+05:30,https://www.ndtv.com/india-news/hyderabad-firm-optimus-pharma-seeks-approval-to-produce-generic-merck-covid-19-pill-molnupiravir-2591229
NDTV-2590468,"Coronavirus India Live Updates: 16,156 New COVID-19 Cases",2021-10-28T00:00:00+05:30,https://www.ndtv.com/india-news/coronavirus-india-live-news-updates-india-reports-13-451-new-coronavirus-cases-in-24-hours-2590468
NDTV-2590312,"Second Dose Of Covid Vaccine Overdue For Around 11 Crore People: Centre",2021-10-27T00:00:00+05:30,https://www.ndtv.com/india-news/second-dose-of-covid-vaccine-overdue-for-around-11-crore-people-centre-2590312
NDTV-2589292,"Over 103.53 Crore COVID-19 Vaccine Doses Administered In India So Far",2021-10-27T00:00:00+05:30,https://www.ndtv.com/india-news/over-103-53-cr-covid-19-vaccine-doses-administered-in-india-so-far-2589292
NDTV-2589233,"13,451 Fresh COVID-19 Cases In India, 8.2% Higher Than Yesterday",2021-10-27T00:00:00+05:30,https://www.ndtv.com/india-news/coronavirus-13-451-fresh-covid-19-cases-in-india-8-2-higher-than-yesterday-2589233
NDTV-2589145,"Coronavirus India Highlights: India Reports 13,451 New Coronavirus Cases In 24 Hours",2021-10-27T00:00:00+05:30,https://www.ndtv.com/india-news/coronavirus-india-live-news-updates-india-reports-12-428-new-covid-19-cases-in-24-hours-2589145
NDTV-2589035,"No Nod For Covaxin Yet, WHO Seeks &quot;Additional Clarifications&quot;",2021-10-27T00:00:00+05:30,https://www.ndtv.com/india-news/additional-clarifications-needed-from-bharat-biotech-to-conduct-final-assessment-of-covaxin-who-2589035
NDTV-2589006,"Days After Reporting 889 Covid Cases, Maharashtra Sees 1,201 New Infections",2021-10-26T00:00:00+05:30,https://www.ndtv.com/india-news/days-after-reporting-889-covid-19-cases-maharashtra-sees-1-201-new-infections-2589006
NDTV-2588753,"Online Health Services Shouldn&#039;t Mislead Citizens On Blood Sample Collection: High Court",2021-10-26T00:00:00+05:30,https://www.ndtv.com/india-news/online-health-services-shouldnt-mislead-citizens-on-blood-sample-collection-delhi-high-court-2588753
NDTV-2588104,"Assam Relaxes Curbs Amid Decline In Covid Cases; Details Here",2021-10-26T00:00:00+05:30,https://www.ndtv.com/india-news/coronavirus-assam-coronavirus-assam-coronavirus-cases-assam-relaxes-curbs-amid-decline-in-covid-cases-details-here-2588104
NDTV-2587909,"India Sees Lowest Daily Surge In Covid Cases (12,428) In Nearly 8 Months",2021-10-26T00:00:00+05:30,https://www.ndtv.com/india-news/coronavirus-india-sees-lowest-daily-surge-in-covid-cases-12-428-in-nearly-8-months-2587909
NDTV-2587893,"&quot;Can&#039;t Doubt Vaccine Efficiency&quot;: Supreme Court Rejects Petition",2021-10-26T00:00:00+05:30,https://www.ndtv.com/india-news/supreme-court-rejects-petition-cant-doubt-vaccine-efficiency-2587893
NDTV-2587817,"Coronavirus India LIVE News Updates: India Reports 12,428 New COVID-19 Cases In 24 Hours",2021-10-27T00:00:00+05:30,https://www.ndtv.com/india-news/coronavirus-india-live-news-updates-india-reports-14-306-new-covid-19-cases-2587817
