id,title,date,url
WIRE-452564,"Odisha Govt Ill-Prepared to Handle the Lakhs of Migrant Workers Coming Home",2020-05-04T10:37:32+05:30,https://thewire.in/post/odisha-migrant-workers-quarantine-jobs
WIRE-452556,"The Mandatory Imposition of the Aarogya Setu App Has No Legal or Constitutional Basis",2020-05-04T10:27:15+05:30,https://thewire.in/post/the-mandatory-imposition-of-the-aarogya-setu-app-has-no-legal-or-constitutional-basis
WIRE-452567,"Congress Will Pay For Migrant Workers' Journeys Back Home: Sonia Gandhi",2020-05-04T09:25:53+05:30,https://thewire.in/post/congress-sonia-gandhi-migrant-workers
WIRE-452561,"Watch | Coronavirus Updates: While Cases Rise, NITI Aayog Member Makes Fishy Claim About 'Numbers Stabilising'",2020-05-04T08:37:32+05:30,https://thewire.in/post/watch-coronavirus-updates-rise-in-cases-expected-to-stabilise-anytime-soon-says-niti-aayog-member
WIRE-452544,"Kashmir's Migrant Workers Face yet Another Lockdown at the Start of a Work Season",2020-05-04T08:00:59+05:30,https://thewire.in/post/kashmir-migrant-workers-lockdown
WIRE-452526,"This Year, the Prospect of a Humble Durga Puja Is an Opportunity Lost for Mamata Banerjee",2020-05-03T18:19:51+05:30,https://thewire.in/post/covid-19-durga-puja-mamata-banerjee
WIRE-452517,"Some Thorny Questions About the Military's Rose Petal Show for 'Corona Warriors'",2020-05-03T17:44:48+05:30,https://thewire.in/post/some-thorny-questions-about-the-militarys-rose-petal-show-for-corona-warriors
WIRE-452513,"COVID-19: Is a Long Lockdown Counterproductive?",2020-05-03T17:09:57+05:30,https://thewire.in/post/covid-19-long-lockdown-counterproductive
WIRE-452480,"SAU Admin, Alumni Respond to The Wire's Report on Students Being Asked to Leave Hostel Due to COVID-19",2020-05-03T15:18:01+05:30,https://thewire.in/post/sau-admin-students-alumni-respond-wire
WIRE-452465,"Police Find 18 Migrant Workers Travelling to UP From Mumbai in Concrete Mixer Truck",2020-05-03T13:06:22+05:30,https://thewire.in/post/migrant-workers-lockdown-concrete-mixer
WIRE-452455,"Within a Month of Lockdown, New COVID-19 Cases Dipped in 8 Countries, But Not India",2020-05-03T12:09:15+05:30,https://thewire.in/post/new-covid-19-cases-lockdown-india
WIRE-452457,"Lokpal Member Justice A.K. Tripathi Passes Away a Month After Testing Positive for COVID-19",2020-05-03T11:49:32+05:30,https://thewire.in/post/lokpal-member-a-k-tripathi-dies-covid-19
WIRE-452424,"Across the World, the Coronavirus Pandemic Has Become an Invitation to Autocracy",2020-05-03T07:00:15+05:30,https://thewire.in/post/coronavirus-pandemic-autocracy
WIRE-452402,"Watch | How a Device Used to Treat Sleep Apnea Is Helping COVID-19 Patients in Britain",2020-05-03T07:00:04+05:30,https://thewire.in/post/watch-how-a-device-used-to-treat-sleep-apnea-is-helping-covid-19-patients-in-britain
WIRE-452404,"After Rumours About Health, North Korea State Media Report Kim Jong Un Appearance",2020-05-02T18:00:03+05:30,https://thewire.in/post/after-rumours-about-health-north-korea-state-media-report-kim-jong-un-appearance
WIRE-452390,"Mamata Government Under Fire for Hiding Data on COVID-19",2020-05-02T17:00:53+05:30,https://thewire.in/post/mamata-banerjee-west-bengal-government-covid-19
WIRE-452385,"India’s Lockdown Is Blind to the Woes of Its Women",2020-05-02T16:00:19+05:30,https://thewire.in/post/indias-lockdown-is-blind-to-the-woes-of-its-women
WIRE-452362,"What Modi and Bhagwat Mean By Saying the Main Lesson from COVID-19 is 'Self Reliance'",2020-05-02T15:09:55+05:30,https://thewire.in/post/narendra-modi-mohan-bhagwat-self-reliance-covid-19
WIRE-452359,"Coronavirus: Delhi Govt to Ask Centre to Classify Zones on Ward Basis",2020-05-02T13:11:46+05:30,https://thewire.in/post/coronavirus-delhi-govt-to-ask-centre-to-classify-zones-on-ward-basis
WIRE-452348,"Delhi: Survey Reveals Only 30% Ration Shops Distributing PDS Grains, Special Kits",2020-05-02T12:15:57+05:30,https://thewire.in/post/delhi-survey-pds-ration-shops
WIRE-452342,"Coronavirus: India to Cap Stimulus Package at $60 Billion to Protect Credit Rating",2020-05-02T11:10:14+05:30,https://thewire.in/post/coronavirus-india-to-cap-stimulus-package-at-60-billion-to-protect-credit-rating
WIRE-452335,"Watch | Coronavirus Updates, May 1: India Extends Lockdown With Zone-Wise Relaxations",2020-05-02T10:35:28+05:30,https://thewire.in/post/watch-coronavirus-updates-may-1-india-extends-lockdown-with-zone-wise-relaxations
WIRE-452251,"For Students Left in Kota, Eerie Silence in Usually Loud Mess Halls and Quarters",2020-05-02T08:00:21+05:30,https://thewire.in/post/kota-lockdown-bihar-jharkhand-students
WIRE-452315,"The Indian Armed Forces and Petals: Yet Another Entertainer for the Indian Public?",2020-05-02T00:04:28+05:30,https://thewire.in/post/indian-armed-forces-flower-petals
WIRE-452283,"Armed Forces to Conduct Fly-Pasts, Shower Petals on Hospitals on May 3",2020-05-01T21:03:23+05:30,https://thewire.in/post/armed-forces-fly-pasts-hospitals-corona-warriors
WIRE-452236,"Why the Supreme Court Should Allow Video Conferencing Even After the Pandemic",2020-05-01T18:30:09+05:30,https://thewire.in/post/supreme-court-video-conference-pandemic
WIRE-452154,"COVID-19 Will Usher in a New Normal. We Must Invest Accordingly.",2020-05-01T18:00:56+05:30,https://thewire.in/post/covid-19-economic-investment
WIRE-452218,"Online Sale of Liquor Could Dilute India’s Efforts to Contain Spread of Coronavirus",2020-05-01T17:30:22+05:30,https://thewire.in/post/liquor-sale-alcohol-coronavirus
WIRE-452203,"Could We Have Done More to Stop the Spread of the Coronavirus?",2020-05-01T17:00:53+05:30,https://thewire.in/post/coronavirus-pandemic-india
WIRE-452167,"India’s Digital Response to COVID-19 Risks Creating a Crisis of Trust",2020-05-01T16:30:59+05:30,https://thewire.in/post/covid-19-aarogya-setu-surveillance
WIRE-452215,"After May 3, Here's What States With Most 'Red Zone' Districts Are Planning",2020-05-01T16:00:21+05:30,https://thewire.in/post/after-may-3-heres-what-states-with-most-red-zone-districts-are-planning
WIRE-452211,"Watch | In The Time of Coronavirus, An Artist Gives a New Spin to Kalighat Patachitra Paintings",2020-05-01T14:58:09+05:30,https://thewire.in/post/watch-coronavirus-kalighat-patachitra
WIRE-452190,"The History of Caste Has Lessons on the Dangers of Social Distancing",2020-05-01T14:30:25+05:30,https://thewire.in/post/social-distancing-dangers-india
WIRE-452186,"Their Village Sealed Off, Worli's Small-Scale Fishers Lose Livelihood",2020-05-01T13:45:25+05:30,https://thewire.in/post/worli-small-scale-fishers-covid-19
WIRE-452178,"Railways Runs Its First Special Train for 1,200 Stranded Migrants",2020-05-01T13:13:24+05:30,https://thewire.in/post/lockdown-train-stranded-migrants
WIRE-452139,"COVID-19 Lockdown: In April, MGNREGA Work Crashed to Lowest in 7 Years",2020-05-01T12:41:21+05:30,https://thewire.in/post/covid-19-lockdown-mgnrega
WIRE-452145,"West Bengal: 105 COVID-19 Patients Have Died, Not 33 as Earlier Reported",2020-05-01T12:27:35+05:30,https://thewire.in/post/west-bengal-105-covid-19-patients-have-died-not-33-as-earlier-reported
WIRE-452151,"Jharkhand to Modify MGNREGA Rules to Provide Work to Returning Migrants",2020-05-01T12:04:47+05:30,https://thewire.in/post/jharkhand-mgnrega-migrant-workers
WIRE-452127,"The Fight Against COVID-19 Needs Local Solutions That Are Aided by the Centre",2020-05-01T11:05:19+05:30,https://thewire.in/post/covid-19-local-solution-central-government
WIRE-452123,"Finance Ministry Modifies Circular on Salary Contribution to PM CARES Fund",2020-05-01T10:10:21+05:30,https://thewire.in/post/finance-ministry-modifies-circular-on-salary-contribution-to-pm-cares-fund
WIRE-452116,"Watch | Coronavirus Updates: 'Clear-Cut Evidence That Remdesivir Helps Patients Recover Sooner'",2020-05-01T08:45:12+05:30,https://thewire.in/post/watch-coronavirus-updates-clear-cut-evidence-that-remdesivir-helps-patients-recover-sooner
WIRE-452106,"COVID-19 Emergency Powers Shouldn't Be Weaponised to Suppress Dissent: UN Human Rights Chief",2020-04-30T23:49:41+05:30,https://thewire.in/post/covid-19-emergency-powers-suppress-dissent-un
WIRE-452103,"Watch | Punjab FM: ‘Staring at Loss of Rs 20,000 Cr, Don't Expect Sizeable Package From Centre’",2020-04-30T23:14:35+05:30,https://thewire.in/post/watch-punjab-fm-manpreet-badal-mitali-interview
WIRE-452096,"COVID-19 Briefing: Health Ministry Notes Rise in Recovery Rate to 25%",2020-04-30T22:41:26+05:30,https://thewire.in/post/covid-19-briefing-health-ministry-recovery-rate
WIRE-452066,"Internet 'Not a Fundamental Right', J&K Tells SC as Students’ Careers Hang in Balance",2020-04-30T21:00:39+05:30,https://thewire.in/post/internet-not-a-fundamental-right-jk-tells-sc-students-careers
WIRE-452036,"Ground Report: Water Scarcity, Unhygienic Toilets for Migrants Stuck in Delhi Shelter",2020-04-30T18:30:19+05:30,https://thewire.in/post/migrant-workers-delhi-yamuna-complex
WIRE-452049,"Reliance Cuts Salaries at Oil & Gas Unit, Mukesh Ambani to Forgo Entire Compensation",2020-04-30T18:17:27+05:30,https://thewire.in/post/reliance-mukesh-ambani-salary-cuts
WIRE-451981,"Why COVID-19 Cases Among Singapore's Migrant Workers are Growing",2020-04-30T17:00:02+05:30,https://thewire.in/post/why-covid-19-cases-among-singapores-migrant-workers-are-growing
WIRE-451975,"After the Pandemic, Will We Rethink How We Plan Our Cities?",2020-04-30T16:04:40+05:30,https://thewire.in/post/city-planning-pandemic
WIRE-451948,"States Must Be Given More Ownership of India's COVID-19 Containment Strategy",2020-04-30T14:13:40+05:30,https://thewire.in/post/covid-19-lockdown-states
WIRE-451929,"Army Troops, Paramilitary Forces Cautioned Against Fake 'Aarogya Setu' App",2020-04-30T13:19:04+05:30,https://thewire.in/post/army-troops-paramilitary-forces-cautioned-against-fake-aarogya-setu-app
WIRE-451923,"India Needs to Open Economy in Measured Way, Says Raghuram Rajan",2020-04-30T12:00:36+05:30,https://thewire.in/post/india-economy-covid-19-raghuram-rajan-rahul-gandhi
WIRE-451910,"COVID-19 Crisis: To Help Farmers, Government Must Expand Ambit of PM Kisan Scheme",2020-04-30T10:50:11+05:30,https://thewire.in/post/government-direct-income-support-farmers-covid-19-crisis
WIRE-451904,"'Inhuman Act': Migrant Workers Sent Back to Maharashtra Without Consultation",2020-04-30T09:15:07+05:30,https://thewire.in/post/inhuman-act-migrant-workers-sent-back-to-maharashtra-without-consultation
WIRE-451901,"Watch | Coronavirus Updates: Indore City Hit-Hard, 94 Cases Reported in a Single-Day",2020-04-30T08:30:54+05:30,https://thewire.in/post/watch-coronavirus-updates-indore-city-hit-hard-94-cases-reported-in-a-single-day
WIRE-451872,"As COVID-19 Death Toll Crosses 1,000, Govt Says Doubling Rate Has Slowed Further",2020-04-29T21:40:27+05:30,https://thewire.in/post/as-covid-19-death-toll-crosses-1000-govt-says-doubling-rate-is-now-taking-longer
WIRE-451799,"In Punjab, Administrative Hurdle Forces Hundreds of Trainee Doctors to Serve Without Pay",2020-04-29T19:45:58+05:30,https://thewire.in/post/punjab-medical-college-stipends
WIRE-451760,"COVID-19 Crisis: Where is Modi’s Fall Guy?",2020-04-29T15:30:31+05:30,https://thewire.in/post/covid-19-crisis-narendra-modi-fall-guy
WIRE-451766,"Deaths From COVID-19 Cross 1,000 Mark in India",2020-04-29T15:12:10+05:30,https://thewire.in/post/deaths-from-covid-19-cross-1000-mark-in-india
WIRE-451707,"Coronavirus Restrictions? Just Another Day in the Lives of Iran's Female Singers",2020-04-29T13:35:30+05:30,https://thewire.in/post/coronavirus-irans-female-singers
WIRE-451702,"West Bengal: Lockdown Violators Attack Police in 'Red Zone' Howrah",2020-04-29T13:23:38+05:30,https://thewire.in/post/west-bengal-lockdown-violators-attack-police-in-red-zone-howrah
WIRE-451666,"From Health and Harassment to Income Security and Loans, India's Gig Workers Need Support",2020-04-29T13:00:24+05:30,https://thewire.in/post/covid-19-lockdown-delivery-gig-workers
WIRE-451614,"Will Bluetooth and Aarogya Setu Allow Us to Safely Exit the COVID-19 Lockdown?",2020-04-29T12:22:10+05:30,https://thewire.in/post/bluetooth-aarogya-setu-covid-19
WIRE-451619,"Three Lessons from Past Epidemics that Will Help India Fight COVID-19",2020-04-29T08:00:40+05:30,https://thewire.in/post/three-lessons-from-past-epidemics-that-will-help-india-fight-covid-19
WIRE-451604,"Grayson’s Art Club Reminds Us That Creativity Is an Essential Part of Being Human",2020-04-29T07:00:37+05:30,https://thewire.in/post/graysons-art-club-reminds-us-that-creativity-is-an-essential-part-of-being-human
WIRE-451572,"Rough Edges: Reading about Collaboration in Captivity",2020-04-29T07:00:26+05:30,https://thewire.in/post/rough-edges-jm-coetzee-waiting-for-the-barbarians
WIRE-451661,"Watch | COVID-19 Updates: Plasma Therapy Not a Proven Cure, Only to be Used for Research: MoHFW",2020-04-29T01:54:04+05:30,https://thewire.in/post/watch-covid-19-updates-plasma-therapy
WIRE-451649,"Watch: 'Govt Callousness Towards Millions Who Are Starving Endangers India's Democracy'",2020-04-28T22:49:26+05:30,https://thewire.in/post/watch-karan-thapar-interview-yamini-aiyar
WIRE-451634,"COVID-19 Briefing: Health Ministry Plays Down 'Plasma Therapy as Cure' Theory",2020-04-28T22:19:34+05:30,https://thewire.in/post/covid-19-health-ministry-plasma-therapy
WIRE-451561,"Assam: Governor Takes Charge of Bodoland Territorial Council",2020-04-28T19:00:57+05:30,https://thewire.in/post/assam-governor-takes-charge-of-bodoland-territorial-council
WIRE-451549,"Are We Headed For an Exit, or For Lockdown 3.0?",2020-04-28T19:00:32+05:30,https://thewire.in/post/coronavirus-lockdown-extension-exit
WIRE-451560,"Coronavirus Hate Speech: BJP MLA in UP Says 'Don't Buy Vegetables from Muslim Sellers'",2020-04-28T18:45:00+05:30,https://thewire.in/post/suresh-tiwari-bjo-muslim-vegetables
WIRE-451519,"With the World on Edge, So Much Is at Stake",2020-04-28T16:00:51+05:30,https://thewire.in/post/coronavirus-pandemic-us-china
WIRE-451486,"In Russia, Anti-Putin Protests Thrive With a Little Help From the Internet",2020-04-28T15:36:38+05:30,https://thewire.in/post/coronavirus-in-russia-anti-government-protests
WIRE-451470,"'We Are in a Crisis': Fear of Uncertain Employment, Livelihood Grips Migrant and Sex Workers",2020-04-28T15:30:18+05:30,https://thewire.in/post/lockdown-migrant-sex-workers
WIRE-451409,"International Students Worried as South Asian University Pushes Them to Go Home",2020-04-28T13:17:21+05:30,https://thewire.in/post/south-asian-university-international-students
WIRE-451461,"HC Tells Delhi Govt to Keep Ration Shops Open, Disburse Food to All",2020-04-28T11:32:09+05:30,https://thewire.in/post/hc-tells-delhi-govt-to-keep-ration-shops-open-disburse-food-to-all
WIRE-451450,"Responding to ICMR Warning, China Says 'Unfair' to Label COVID-19 Test Kits as 'Faulty'",2020-04-28T09:38:58+05:30,https://thewire.in/post/icmr-china-testing-kits
WIRE-451453,"After Tests Reveal Variations, ICMR Tells States to Stop Using Chinese COVID-19 Kits",2020-04-28T09:15:41+05:30,https://thewire.in/post/icmr-chinese-covid-19-test-kits
WIRE-451447,"Watch | Coronavirus Updates, April 27: Muscle Pain and Headache Possible COVID-19 Symptoms: CDC",2020-04-28T08:52:23+05:30,https://thewire.in/post/watch-coronavirus-updates-april-27-muscle-pain-and-headache-possible-covid-19-symptoms-cdc
WIRE-451402,"#TyphoidMary – Now a Hashtag – Was a Maligned Immigrant Who Got a Bad Rap",2020-04-28T07:00:59+05:30,https://thewire.in/post/typhoidmary-now-a-hashtag-was-a-maligned-immigrant-who-got-a-bad-rap
WIRE-451394,"Latin America: Deaths and Desperation Mount in Ecuador",2020-04-28T07:00:57+05:30,https://thewire.in/post/latin-america-deaths-and-desperation-mount-in-ecuador
WIRE-451378,"COVID-19 Briefing: Central Teams Turn in Pune, Jaipur Reports; Health Ministry Asks to Fight Stigma",2020-04-27T19:45:11+05:30,https://thewire.in/post/covid-19-daily-briefing-pune-jaipru-imct
WIRE-451368,"There Is Little to Be Achieved by Debating Who Let the Novel Coronavirus Out",2020-04-27T19:20:09+05:30,https://thewire.in/post/coronavirus-international-collaboration-disease-prevention
WIRE-451375,"SC Asks for Centre's Reply on PIL of Journalists' Bodies on Media Firings, Pay Cuts",2020-04-27T18:40:52+05:30,https://thewire.in/post/supreme-court-media-job-loss-pay-cut
WIRE-451321,"Will COVID-19 Intensify the Fault Lines of India's Already Unequal Society?",2020-04-27T16:30:32+05:30,https://thewire.in/post/india-inequality-covid-19
WIRE-451331,"States Can Formulate Policies on Relaxing Lockdown After May 3: Narendra Modi",2020-04-27T16:21:31+05:30,https://thewire.in/post/india-lockdown-narendra-modi-may-3
WIRE-451259,"India's COVID-19 Testing Conundrum: Why the Govt and Its Critics Are Both Right",2020-04-27T16:00:56+05:30,https://thewire.in/post/india-covid-19-testing-contradiction-rate
WIRE-451304,"Back at Work, British PM Boris Johnson Faces Lockdown Catch-22",2020-04-27T15:14:59+05:30,https://thewire.in/post/back-at-work-british-pm-boris-johnson-faces-lockdown-catch-22
WIRE-451272,"'Azaan May be Carried Out,' Says Delhi Police, After Video of Policemen Enforcing 'Ban' Goes Viral",2020-04-27T13:50:44+05:30,https://thewire.in/post/delhi-police-azaan-ramzan-ban
WIRE-451261,"Post COVID-19, What Will the World Order Look Like?",2020-04-27T13:36:10+05:30,https://thewire.in/post/post-covid-19-world-order
WIRE-451230,"In Rejig, Two Bureaucrats from PMO Appointed Secretaries",2020-04-27T13:15:33+05:30,https://thewire.in/post/in-rejig-two-bureaucrats-from-pmo-appointed-secretaries
WIRE-451244,"Coronavirus Tracking Apps and How Countries Are Monitoring Infections Through Them",2020-04-27T12:44:10+05:30,https://thewire.in/post/coronavirus-tracking-apps-world
WIRE-451241,"Convert World's Hatred for China Into Economic Opportunity, Advises Gadkari",2020-04-27T12:33:28+05:30,https://thewire.in/post/china-coronavirus-hatred-gadkari
WIRE-451236,"Allow Migrant Labourers to Reach Home by Train: Adhir Ranjan Chowdhury Writes to PM",2020-04-27T12:23:16+05:30,https://thewire.in/post/allow-migrant-labourers-to-reach-home-by-train-adhir-ranjan-chowdhury-writes-to-pm
WIRE-451189,"Factory Workers Can Now Legally Be Asked to Work 12-Hour Shifts. How Will this Change Things?",2020-04-27T12:00:29+05:30,https://thewire.in/post/factory-workers-12-hour-shifts
WIRE-451218,"Minorities Panel Urges Release of Tablighi Jamaat Members at Quarantine Camps",2020-04-27T11:50:51+05:30,https://thewire.in/post/delhi-minorities-panel-tablighi-jamaat
WIRE-451213,"Lack of Clarity in MHA Likely Led to 3 Indians' Bodies Being Returned From Airport",2020-04-27T10:05:42+05:30,https://thewire.in/post/mha-indian-bodies-returned-delhi-airport
WIRE-451198,"Finance Ministry Slams IRS Officers' Proposal on Levying a COVID-19 Wealth Tax",2020-04-27T09:01:57+05:30,https://thewire.in/post/finance-ministry-irs-officers-covid-19-wealth-tax
WIRE-451090,"Turkey Is Releasing Murderers – but Not Political Opponents – From Prison ",2020-04-27T07:00:34+05:30,https://thewire.in/post/turkey-is-releasing-murderers-but-not-political-opponents-from-prison
WIRE-451182,"Unless the Congress is Reborn, It Can't Be the Vehicle for Transformation India Needs",2020-04-27T07:00:02+05:30,https://thewire.in/post/unless-the-congress-is-reborn-it-cant-be-the-vehicle-for-transformation-india-needs
WIRE-451176,"COVID-19 Patients Under Government Care in Delhi Complain of Poor Conditions",2020-04-26T22:19:37+05:30,https://thewire.in/post/covid-19-patients-under-government-care-in-delhi-complain-of-poor-conditions
WIRE-451162,"Lockdown Has Taught Us More Than a Thing or Two. But Will the Lessons Last?",2020-04-26T17:35:24+05:30,https://thewire.in/post/life-after-lockdown-lessons-learnt
WIRE-451143,"Community Transmission: Coronavirus Enters Bengal's Folk-Art Form",2020-04-26T16:40:38+05:30,https://thewire.in/post/community-transmission-coronavirus-enters-an-ancient-folk-art-form
WIRE-451124,"Prisoner Releases Across Asia: A Right Move Gone Wrong?",2020-04-26T16:00:23+05:30,https://thewire.in/post/prisoner-releases-across-asia-a-right-move-gone-wrong
WIRE-451127,"After Flip-Flops, Delhi Says It Will Follow Centre’s Diktats on Lockdown Relaxations",2020-04-26T15:18:10+05:30,https://thewire.in/post/after-flip-flops-delhi-says-it-will-follow-centres-diktats-on-lockdown-relaxations
WIRE-451079,"The Intricate Dance of Politics and Power During a Pandemic",2020-04-26T14:30:44+05:30,https://thewire.in/post/pandemic-politics-power
WIRE-451099,"Coronavirus and Germany: Why the World Is Looking to Angela Merkel",2020-04-26T13:00:26+05:30,https://thewire.in/post/coronavirus-and-germany-why-the-world-is-looking-to-angela-merkel
WIRE-451085,"Woman Raped by Three Men in Rajasthan at a School During Lockdown",2020-04-26T12:30:58+05:30,https://thewire.in/post/woman-raped-by-three-men-in-rajasthan-at-a-school-during-lockdown
WIRE-451053,"Watch | Coronavirus Updates, April 25: Govt 'Postpones' Use of Rapid Test Kits",2020-04-26T10:09:14+05:30,https://thewire.in/post/watch-coronavirus-updates-april-25
WIRE-451021,"'We Go Where No One Goes': The Aviation Sector Workers Rescuing Stranded Indians",2020-04-26T08:00:14+05:30,https://thewire.in/post/coronavirus-aviation-workers
WIRE-451005,"Punjab Sends Quarantined Kashmiris Home for Ramzaan, Rekindles Hopes of Others",2020-04-25T22:55:59+05:30,https://thewire.in/post/punjab-sends-quarantined-kashmiris-home-for-ramzaan-rekindles-hopes-of-others
WIRE-450966,"PM CARES Fund to Be Audited by 'Independent Auditors' Instead of CAG: Report",2020-04-25T20:30:37+05:30,https://thewire.in/post/pm-cares-audit-cag
WIRE-450947,"Phasing out India's Lockdown Is Essential, but With More Nuance Than What's Been Done So Far",2020-04-25T18:30:52+05:30,https://thewire.in/post/india-lockdown-fiscal-policy
WIRE-450997,"Backstory: In Parallel With the COVID 19 Pandemic, We Now Have a Pandemic of Arrests",2020-04-25T18:29:09+05:30,https://thewire.in/post/backstory-pandemic-arrests-gautam-navlakha-anand-teltumbde
WIRE-451039,"Reinventing Agriculture in the Time of COVID-19",2020-04-25T18:00:50+05:30,https://thewire.in/post/reinventing-agriculture-in-the-time-of-covid-19
WIRE-450915,"'We Refuse to Die in Jail': Argentine Inmates Set Fire to Prison in Coronavirus Protest",2020-04-25T16:17:31+05:30,https://thewire.in/post/we-refuse-to-die-in-jail-argentine-inmates-set-fire-to-prison-in-coronavirus-protest
WIRE-450933,"How Mamata Banerjee Lost, Then Regained Steam in the Fight Against COVID-19",2020-04-25T16:15:12+05:30,https://thewire.in/post/bengal-coronavirus-mamata-banerjee
WIRE-450905,"US Supreme Court Refuses States' Bid to Block Trump Immigration Policy During Pandemic",2020-04-25T13:46:05+05:30,https://thewire.in/post/us-supreme-court-refuses-states-bid-to-block-trump-immigration-policy-during-pandemic
WIRE-450899,"Rabi Crops From Other States Not Allowed in Haryana Mandis, Says DGP",2020-04-25T11:59:08+05:30,https://thewire.in/post/rabi-crops-from-other-states-not-allowed-in-haryana-mandis-says-dgp
WIRE-450897,"More Than 70,000 Stranded People Permitted to Move Within Assam",2020-04-25T11:58:03+05:30,https://thewire.in/post/assam-lockdown-stranded-home
WIRE-450894,"Did Prashant Kishor Take a Flight During Lockdown? Centre Asks Airlines",2020-04-25T11:30:15+05:30,https://thewire.in/post/prashant-kishor-flight-lockdown
WIRE-450891,"Two Tablighi Jamaat Members Die at Quarantine Facility, Minorities Panel Seeks Probe",2020-04-25T11:11:11+05:30,https://thewire.in/post/delhi-quarantine-tablighi-jamaat
WIRE-450888,"Watch | Coronavirus Updates, April 24: Leaked Study Shows Remdesivir Ineffective Against COVID-19",2020-04-25T10:25:00+05:30,https://thewire.in/post/coronavirus-remdesivir-study-who
WIRE-450875,"China Has Approved 35 Cargo Flights for Supply of Medical Items: Chinese Envoy",2020-04-24T22:32:04+05:30,https://thewire.in/post/china-cargo-flights-supply-medical-supplies
WIRE-450810,"A Cruel Lockdown: Lessons From Relief Work in Mumbai",2020-04-24T19:30:43+05:30,https://thewire.in/post/coronavirus-lockdown-mumbai-relief-work
WIRE-450825,"What Happens to Airlines Now?",2020-04-24T18:15:38+05:30,https://thewire.in/post/what-happens-to-airlines-now
WIRE-450797,"Is the Press Council Being Selective in Upholding Media Freedom? ",2020-04-24T17:30:51+05:30,https://thewire.in/post/press-council-media-freedom-arnab-goswami
WIRE-450787,"Kashmir: The Lockdown Within the Lockdown",2020-04-24T17:00:22+05:30,https://thewire.in/post/kashmir-the-lockdown-within-the-lockdown
WIRE-450792,"Yuval Noah Harari, on Hatred that Poses a Bigger Danger Than the Virus Itself",2020-04-24T16:45:29+05:30,https://thewire.in/post/yuval-noah-harari-on-hatred-that-poses-a-bigger-danger-than-the-virus-itself
WIRE-450794,"In a Virtual Courtroom, Signs of Long-Awaited Change",2020-04-24T16:30:36+05:30,https://thewire.in/post/coronavirus-lockdown-virtual-court
WIRE-450725,"Lockdown Is Disrupting a Generation's Education. What Can Be Done?",2020-04-24T15:45:52+05:30,https://thewire.in/post/coronavirus-lockdown-education-students
WIRE-450752,"Four Measures That Can Help Farmers Deal With the Impact of COVID-19 Lockdown",2020-04-24T15:00:00+05:30,https://thewire.in/post/farmers-covid-19-lockdown-india-relief-measures
WIRE-450707,"On COVID-19, the Centre Has Foisted All Responsibility on the States",2020-04-24T14:11:10+05:30,https://thewire.in/post/covid-19-modi-government-states
WIRE-450736,"COVID-19 Lockdown: India's Power Demand Falls By 19%",2020-04-24T14:10:59+05:30,https://thewire.in/post/covid-19-lockdown-indias-power-demand-falls-by-19
WIRE-450750,"Interview | 'Large Reset in Economic Superpowers Unlikely, China’s Influence Will Stay'",2020-04-24T13:09:15+05:30,https://thewire.in/post/interview-large-reset-in-economic-superpowers-unlikely-chinas-influence-will-stay
WIRE-450724,"Across the World, a Shadow Over Ramadan",2020-04-24T12:36:17+05:30,https://thewire.in/post/ramadan-fasting-coronavirus
