id,title,date,url
WIRE-469989,"Tamil Nadu: Blanket of Silence Over Caste-Based Atrocities During COVID-19 Lockdown",2020-07-30T12:00:10+05:30,https://thewire.in/post/tamil-nadu-dalit-tribal-violence-atrocities-covid-19-lockdown-silence
WIRE-469903,"Ground Report: 'Bihar Leaders on Aerial Surveys Should Come on a Boat to See How We're Living'",2020-07-29T21:25:14+05:30,https://thewire.in/post/bihar-floods-ground-report-champaran-sanjay-kumar-jha
WIRE-469912,"Unlock 3: Schools to Remain Closed Till Aug 31, Independence Day Functions Allowed",2020-07-29T20:16:43+05:30,https://thewire.in/post/unlock-3-home-ministry-schools-containment-zones-lockdown-independence-day
WIRE-469827,"As US Elections Draw Nearer, Efforts Are On to Woo Black Votes",2020-07-29T16:00:23+05:30,https://thewire.in/post/us-elections-donald-trump-joe-biden-black-voters-john-lewis
WIRE-469791,"Amitabh Bachchan and the Brahmanical Syndrome",2020-07-29T13:49:19+05:30,https://thewire.in/post/amitabh-bachchan-and-the-brahmanical-syndrome
WIRE-469778,"Twitter Temporarily Restricts Donald Trump Jr's Account Over COVID-19 Video Touting HCQ",2020-07-29T13:45:49+05:30,https://thewire.in/post/twitter-donald-trump-jr-covid-19-hydroxychloroquine-hcq
WIRE-469757,"Economy in For Worse Times as Workers Return From Abroad, Remittances Fall",2020-07-29T13:42:01+05:30,https://thewire.in/post/indian-economy-workers-abroad-visa-msme-gdp-growth-rate
WIRE-469728,"Ahead of Ram Temple Bhoomi Pujan, Ayodhya Admin Puts Restrictions on TV Reporting",2020-07-29T11:45:58+05:30,https://thewire.in/post/ayodhya-ram-temple-mandir-bhoomi-pujan-tv-media-restrictions
WIRE-469725,"Nearly 1.9 Lakh Applicants, 4k+ Employers Log Into Delhi Govt’s New Job Portal on First Day",2020-07-29T10:54:48+05:30,https://thewire.in/post/delhi-government-job-portal
WIRE-469722,"Watch: Beware of Fake N95 Masks, Govt Says They May Be Detrimental to Health",2020-07-29T10:05:25+05:30,https://thewire.in/post/coronavirus-n95-face-masks
WIRE-469714,"Watch: 15 Lakh COVID-19 Cases in India But TV Channels Busy With Ayodhya, Rafale",2020-07-29T09:30:29+05:30,https://thewire.in/post/watch-15-lakh-covid-19-cases-in-india-but-tv-channels-busy-with-ayodhya-rafale
WIRE-469680,"Excerpt: RBI Ex-Deputy Gov Viral Acharya on How Well the Central Bank Did in Restoring Financial Stability",2020-07-29T07:00:33+05:30,https://thewire.in/post/book-rbi-deputy-gov-viral-acharya-bankruptcy
WIRE-469682,"Bengal Extends Lockdown to August 31, 2-Day Weekly Shutdowns to Continue",2020-07-28T21:18:34+05:30,https://thewire.in/post/west-bengal-extends-lockdown-weekly-mamata-banerjee
WIRE-469597,"As the Spread of Coronavirus Gets 'Decentralised', Kerala Needs to Reboot",2020-07-28T19:30:35+05:30,https://thewire.in/post/kerala-coronavirus-covid-19-rise-pinarayi-vijayan-left-government
WIRE-469609,"Bombay HC Rejects DU Professor G.N. Saibaba's Bail Plea",2020-07-28T17:18:01+05:30,https://thewire.in/post/gn-saibaba-professor-covid-19-maoist-link-bail-bombay-hc
WIRE-469584,"Explained: How Turkey President Erdoğan is Using COVID-19 to Stifle Dissent",2020-07-28T16:54:03+05:30,https://thewire.in/post/explained-how-turkey-president-erdogan-is-using-covid-19-to-stifle-dissent
WIRE-469480,"Watch: India's COVID-19 Epidemic Is Growing at the Fastest Rate Globally",2020-07-28T11:00:42+05:30,https://thewire.in/post/watch-indias-covid-19-epidemic-is-growing-at-the-fastest-rate-globally
WIRE-469470,"With GPS Watches, Nagpur Municipal Corporation Ups Surveillance on Sanitation Workers",2020-07-28T09:08:35+05:30,https://thewire.in/post/sanitation-workers-nagpur-gps-tracking
WIRE-469366,"What Should Those in Politics Do in Times of Powerlessness?",2020-07-28T07:00:38+05:30,https://thewire.in/post/coronavirus-covid-19-politics-india-disease-congress-bjp-mamata
WIRE-469399,"Pragya Thakur Asks People to Chant Hanuman Chalisa Until August 5 to 'End Coronavirus'",2020-07-27T17:00:28+05:30,https://thewire.in/post/pragya-thakur-hanuman-chalisa-coronavirus
WIRE-469376,"Several State Govts Issue Guidelines on Bakr Eid, Some Ban Public Goat Slaughter",2020-07-27T16:30:38+05:30,https://thewire.in/post/bakr-eid-covid-19-guidelines
WIRE-469247,"COVID-19 Is Spreading Through Odisha's Jails. Authorities Must Do More to Contain it.",2020-07-27T14:47:31+05:30,https://thewire.in/post/odisha-prisons-covid-19-spread
WIRE-469319,"India's COVID-19 Tally Crosses 14-Lakh Mark With Another Record Single-Day Spike",2020-07-27T13:39:43+05:30,https://thewire.in/post/indias-covid-19-tally-crosses-14-lakh-mark-with-another-record-single-day-spike
WIRE-469251,"Watch: Mallika Sarabhai on Losses the Performing Arts Industry Is Facing Due to COVID-19",2020-07-27T11:30:24+05:30,https://thewire.in/post/watch-mallika-sarabhai-on-losses-the-performing-arts-industry-is-facing-due-to-covid-19
WIRE-469244,"Watch: For the Fifth Straight Day, India Adds Over 45,000 New Infections",2020-07-27T10:02:48+05:30,https://thewire.in/post/watch-for-the-fifth-straight-day-india-adds-over-45000-new-infections
WIRE-469140,"President Kovind, PM Modi Note 21st Anniversary of Kargil War Victory",2020-07-26T18:25:34+05:30,https://thewire.in/post/president-kovind-pm-modi-note-21st-anniversary-of-kargil-war-victory
WIRE-469154,"In Urjit Patel’s ‘Overdraft', a Peek at How India's Bankruptcy Code Was Slowly Diluted",2020-07-26T16:00:31+05:30,https://thewire.in/post/urjit-patel-book-overdraft-bankruptcy-code-rbi-arun-jaitley
WIRE-469104,"Amidst COVID-19, Hurricane Hanna Lashes South Texas Coast",2020-07-26T11:35:10+05:30,https://thewire.in/post/hurricane-hanna-texas-coast-atlantic-storm-season-covid-19
WIRE-469105,"COVID-19: India's Case Count Rises by More Than 45,000 for Fourth Consecutive Day",2020-07-26T11:26:29+05:30,https://thewire.in/post/covid-19-india-numbers-deaths-recovery-case-count
WIRE-469096,"North Korea: First Suspected COVID-19 Case Reported; Emergency Declared in Border Town",2020-07-26T11:15:49+05:30,https://thewire.in/post/north-korea-covid-19-emergency-kim-jong-un
WIRE-469068,"Podcast | How Will the Coronavrius Crisis Impact Climate Policy?",2020-07-26T07:00:24+05:30,https://thewire.in/post/podcast-how-will-the-coronavrius-crisis-impact-climate-policy
WIRE-469076,"COVID-19 in South Africa: Popular Movements Mobilise Under Lockdown",2020-07-26T07:00:18+05:30,https://thewire.in/post/covid-19-in-south-africa-popular-movements-mobilise-under-lockdown
WIRE-468992,"UK PM Johnson Says Maybe He Could Have Managed Pandemic Differently",2020-07-25T15:46:00+05:30,https://thewire.in/post/johnson-says-could-have-managed-pandemic-differently
WIRE-469034,"Madhya Pradesh Chief Minister Shivraj Singh Chouhan Tests Positive for COVID-19",2020-07-25T14:00:09+05:30,https://thewire.in/post/madhya-pradesh-chief-minister-shivraj-singh-chouhan-covid-19-positive
WIRE-469008,"WHO Reports Records Daily Increase of Over 284,000 Global Coronavirus Cases",2020-07-25T12:30:52+05:30,https://thewire.in/post/increase-of-over-284000-global-coronavirus-cases
WIRE-468907,"COVID-19 in Russia: Mishandling Has Led to Popular Protests but Putin Remains Strong",2020-07-25T07:30:03+05:30,https://thewire.in/post/covid-19-russia-vladimir-putin
WIRE-468827,"US COVID-19 Deaths Top 1,100 For 3rd Day in a Row, Trump Pushes for Schools to Reopen",2020-07-24T18:42:34+05:30,https://thewire.in/post/us-coronavirus-deaths-donald-trump-schools-reopen
WIRE-468817,"EC Defers Bypolls for One LS, 7 Assembly Seats Amid COVID-19, Flood Warnings",2020-07-24T17:48:13+05:30,https://thewire.in/post/ec-defers-bypolls-for-one-ls-7-assembly-seats-amid-covid-19-flood-warnings
WIRE-468814,"COVID-19 and Mental Health: Suicidal Tendencies and Self-Harm on the Rise",2020-07-24T15:30:39+05:30,https://thewire.in/post/covid-19-mental-health-suicidal-tendencies-self-harm-rise
WIRE-468813,"'Moratorium Extension Will Determine Economic Recovery in India'",2020-07-24T14:55:04+05:30,https://thewire.in/post/moratorium-extensio-determine-economic-recovery-india-chris-wood
WIRE-468782,"WHO Chief Tedros: Comments Questioning Independence are 'Untrue and Unacceptable'",2020-07-24T14:22:04+05:30,https://thewire.in/post/who-chief-tedros-comments-questioning-independence-are-untrue-and-unacceptable
WIRE-468775,"Layoffs During Pandemic Shows India Inc's Lack of Empathy: Ratan Tata",2020-07-24T13:44:09+05:30,https://thewire.in/post/ratan-tata-layoffs-covid-19
WIRE-468772,"Over 44% Inmates in Guwahati Jail Test Positive for COVID-19",2020-07-24T13:42:04+05:30,https://thewire.in/post/over-44-inmates-in-guwahati-jail-test-positive-for-covid-19
WIRE-468763,"Countries Are Adapting Intellectual Property Laws to Prioritise Health During COVID-19",2020-07-24T13:15:15+05:30,https://thewire.in/post/intellectual-property-laws-covid-19
WIRE-468776,"Watch: Indians Can Be Prescribed 5 Drugs for COVID-19. How Safe and Efficacious Are They?",2020-07-24T12:09:28+05:30,https://thewire.in/post/watch-covid-19-drugs-safety-efficacy
WIRE-468757,"Delhi: 14-Year-Old Sexually Assaulted at COVID Care Centre",2020-07-24T10:55:54+05:30,https://thewire.in/post/delhi-14-year-old-sexually-assaulted-covid-care-centre
WIRE-468740,"BRICS and COVID: Rising Powers in a Time of Pandemic",2020-07-24T08:40:31+05:30,https://thewire.in/post/brics-and-covid-rising-powers-in-a-time-of-pandemic
WIRE-468594,"Floods Wreak Havoc Over Large Swathes of North Bihar",2020-07-23T20:25:05+05:30,https://thewire.in/post/floods-wreak-havoc-over-large-swathes-of-north-bihar
WIRE-468604,"Bihar Gives a Thumbs Down to Nitish Kumar's Hackneyed Slogans",2020-07-23T16:00:46+05:30,https://thewire.in/post/bihar-gives-a-thumbs-down-to-nitish-kumars-hackneyed-slogans
WIRE-468547,"'No Time for Experimentation': Food Rights Activists on Delhi’s Doorstep Ration Delivery Scheme",2020-07-23T14:00:36+05:30,https://thewire.in/post/no-time-for-experimentation-food-rights-activists-on-delhis-doorstep-ration-delivery-scheme
WIRE-468546,"COVID-19: India Adds One Lakh Cases in Three Days; Crosses 12-Lakh Mark",2020-07-23T12:47:24+05:30,https://thewire.in/post/covid-19-india-adds-one-lakh-cases-in-three-days-crosses-12-lakh-mark
WIRE-468518,"COVID-19: California Reports 12,000 Cases in a Day, Tally Crosses New York",2020-07-23T12:43:06+05:30,https://thewire.in/post/covid-19-california-reports-12000-cases-in-a-day-tally-crosses-new-york
WIRE-468320,"I Don’t Believe in Crushing Thoughts Opposed to Mine: Folk Singer, BJP Leader Kalpana Patowary",2020-07-22T14:00:56+05:30,https://thewire.in/post/i-dont-believe-in-crushing-thoughts-opposed-to-mine-folk-singer-bjp-leader-kalpana-patowary
WIRE-468293,"COVID-19 Impact: LinkedIn Cuts 960 Jobs as Corporate Hiring Halts",2020-07-22T13:41:39+05:30,https://thewire.in/post/covid-19-linkedin-job-loss-firing-microsoft-corporate-hiring
WIRE-468261,"Telangana, Karnataka Opposition Use AP’s Measures to Prove COVID Mishandling in Own States",2020-07-22T11:30:49+05:30,https://thewire.in/post/telangana-karnataka-opposition-use-aps-measures-to-prove-covid-mishandling-in-own-states
WIRE-468190,"No Lockdown in Bengaluru or Anywhere in Karnataka, Says Yediyurappa",2020-07-21T19:04:59+05:30,https://thewire.in/post/karnataka-bengaluru-lockdown-bs-yediyurappa
WIRE-468137,"Air India's Furlough Scheme Illegal, Abominable: Workers' Unions to Aviation Minister",2020-07-21T16:06:44+05:30,https://thewire.in/post/air-india-hardeep-singh-puri-leave-without-pay-lwp-jobs
WIRE-468103,"After Former Head Priest Dies Due to COVID-19, Tirumala Temple Under Pressure to Close",2020-07-21T14:30:04+05:30,https://thewire.in/post/after-former-head-priest-dies-due-to-covid-19-tirumala-temple-under-pressure-to-close
WIRE-468087,"COVID-19: More Than 30k New Cases in India for Sixth Consecutive Day",2020-07-21T12:35:52+05:30,https://thewire.in/post/covid-19-india-july-21
WIRE-467959,"To No One's Surprise, Online Schooling Has Started Taking a Psychological Toll on Students",2020-07-21T07:00:54+05:30,https://thewire.in/post/online-education-students
WIRE-468025,"To Contain Community Spread, Bengal Announces 2-Day Statewide Lockdown Every Week",2020-07-20T18:49:27+05:30,https://thewire.in/post/west-bengal-covid-19-2-day-lockdown-community-transmission
WIRE-467978,"Bolsonaro's Colossal Negligence Sparks 'Genocide' Debate in Brazil  ",2020-07-20T18:00:14+05:30,https://thewire.in/post/brazil-covid-19-jair-bolsonaro-genocide-negligence
WIRE-467950,"Delhi: Rains Claim Four Lives; Streets Waterlogged and Houses Collapse",2020-07-20T15:45:20+05:30,https://thewire.in/post/delhi-rains-july-19-four-deaths-waterlog-collapse-houses
WIRE-467928,"COVID-19: With Another Record Daily Jump, India Crosses 11-Lakh Mark",2020-07-20T14:04:36+05:30,https://thewire.in/post/covid-19-with-another-record-daily-jump-india-crosses-11-lakh-mark
WIRE-467872,"Podcast: Why Bihar Should Increase COVID-19 Testing",2020-07-20T10:41:44+05:30,https://thewire.in/post/podcast-why-bihar-should-increase-covid-19-testing
WIRE-467824,"Making A Film To Gauge The Temperature Of The World On A Single Day",2020-07-19T16:30:50+05:30,https://thewire.in/post/kevin-macdonald-interview-life-in-a-day
WIRE-467800,"COVID-19: Record Single-Day Spike of 38,902 Cases in India",2020-07-19T15:13:41+05:30,https://thewire.in/post/covid-19-record-single-day-spike-cases-in-india
WIRE-467785,"Varavara Rao Shifted to Nanavati Hospital for Neurological Treatment",2020-07-19T13:49:51+05:30,https://thewire.in/post/varavara-rao-nanavati-hospital-treatment
WIRE-467442,"Examining India’s Quest to Regulate, Govern and Exploit Non-Personal Data ",2020-07-18T19:30:53+05:30,https://thewire.in/post/non-personal-data-protection-anonymisation
WIRE-467625,"Three Reported Suicides in Jaipur Hospital Raise Questions on Negligence, Stigma",2020-07-18T13:25:57+05:30,https://thewire.in/post/jaipur-covid-19-suicide-hospital
WIRE-467555,"Centre Asks WB, Assam, Bihar, Odisha to Strengthen Efforts to Combat COVID-19",2020-07-18T13:15:31+05:30,https://thewire.in/post/centre-asks-states-to-strengthen-efforts
WIRE-467436,"Rose Raponda Becomes Gabon's First Woman Prime Minister",2020-07-17T13:00:51+05:30,https://thewire.in/post/rose-raponda-becomes-gabons-first-woman-prime-minister
WIRE-467306,"Assam: 'No Food or Water,' 100 Patients Break Out of COVID-19 Care Centre",2020-07-17T12:37:42+05:30,https://thewire.in/post/assam-100-patients-break-out-covid-care-centre
WIRE-467285,"Educational Institutions Pressure Teachers to Demand Fees, Admit New Students",2020-07-17T07:00:51+05:30,https://thewire.in/post/educational-institutions-pressure-teachers-to-demand-fees-admit-new-students
WIRE-467367,"Gauhati HC Grants Akhil Gogoi Bail in 3 Cases Filed by Assam Police",2020-07-16T21:05:40+05:30,https://thewire.in/post/akhil-gogoi-bail-gauhati-hc-nia-uapa
WIRE-467333,"COVID-19 Unlock: India Establishes 'Air Travel Bubbles' With US, France",2020-07-16T20:23:52+05:30,https://thewire.in/post/covid-19-unlock-india-establishes-air-travel-bubbles-with-us-france
WIRE-467279,"The Lockdown Revealed the Extent of Poverty and Misery Faced by Migrant Workers",2020-07-16T19:00:44+05:30,https://thewire.in/post/covid-19-poverty-migrant-workers
WIRE-467235,"India Records 30,000 New COVID-19 Cases in Highest-Ever Single-Day Spike",2020-07-16T14:30:55+05:30,https://thewire.in/post/india-records-30000-new-covid-19-cases-in-highest-ever-single-day-spike
WIRE-467180,"How a Viral Video Tore Apart Bihar Govt’s Claims on Efficiently Handling COVID-19",2020-07-16T13:30:08+05:30,https://thewire.in/post/how-a-viral-video-tore-apart-bihar-govts-claims-on-efficiently-handling-covid-19
WIRE-467181,"Watch: India Adds Over 32,000 News Cases, Delhi Turns COVID-19 Curve",2020-07-16T10:34:58+05:30,https://thewire.in/post/watch-india-adds-over-32000-news-cases-delhi-turns-covid-19-curve
WIRE-467115,"Watch | 'India Will Be Lucky If We Finish at 1 Crore COVID-19 Cases'",2020-07-15T19:53:22+05:30,https://thewire.in/post/watch-shobana-kamineni-mitali-mukherjee-covid-19-video
WIRE-467030,"Teenager Sent to Juvenile Detention For Not Submitting Online Schoolwork",2020-07-15T19:29:06+05:30,https://thewire.in/post/teenager-sent-to-juvenile-detention
WIRE-467038,"Kolkata: Teen's Death After 3 Hospitals Refuse Entry Puts Focus on Collapsing Health System",2020-07-15T16:41:34+05:30,https://thewire.in/post/kolkata-health-covid-10-private-hospitals
WIRE-467004,"In Malaysia, Media Crackdowns Are Driven by an Insecure Govt's Sensitivity to Criticism",2020-07-15T14:51:35+05:30,https://thewire.in/post/in-malaysia-media-crackdowns-are-driven-by-an-insecure-govts-sensitivity-to-criticism
WIRE-466969,"Haryana: Nurses at Panchkula Hospital Thrash Doctor Accused of Sexual Harassment",2020-07-15T12:42:08+05:30,https://thewire.in/post/haryana-nurses-at-panchkula-hospital-thrash-doctor-accused-of-sexual-harassment
WIRE-466968,"India's COVID-19 Graph Still Moving Upwards, Another Record Daily Spike Seen",2020-07-15T12:04:40+05:30,https://thewire.in/post/indias-covid-19-graph-still-moving-upwards-another-record-daily-spike-seen
WIRE-466936,"Earning Less Than Minimum Wage, Medical Interns Go on Strike Across UP",2020-07-15T09:44:48+05:30,https://thewire.in/post/medical-interns-strike-uttar-pradesh
WIRE-466806,"Final Year UG Online Exams From August 10-31: Delhi University Tells HC",2020-07-14T17:37:31+05:30,https://thewire.in/post/delhi-university-du-final-year-ug-online-exams
WIRE-466822,"Watch | 'If ICMR Survey Is Correct, Coronavirus Cases in India Could Be 140 Million'",2020-07-14T17:33:14+05:30,https://thewire.in/post/watch-karan-thapar-interview-shahid-jameel
WIRE-466741,"As COVID-19 Sweeps Karnataka, ASHA Workers, AYUSH Doctors Strike for Better Pay",2020-07-14T17:01:51+05:30,https://thewire.in/post/covid-19-karnataka-asha-workers-ayush-doctors-strike-pay
WIRE-466746,"Wipro Chairman Says No Plans to Lay Off Employees Due to COVID-19 Pandemic",2020-07-14T15:37:32+05:30,https://thewire.in/post/wipro-chairman-says-no-plans-to-lay-off-employees-due-to-covid-19-pandemic
WIRE-466716,"Passenger Vehicle Sales Fell Nearly 50% in June 2020 as Lockdown Continues to Take Economic Toll",2020-07-14T13:34:19+05:30,https://thewire.in/post/passenger-vehicle-sales-fell-nearly-50-in-june-2020-as-lockdown-continues-to-take-economic-toll
WIRE-466668,"Kashmir: Prisoner Detained Under Public Safety Act Tests Positive for COVID-19",2020-07-14T10:50:52+05:30,https://thewire.in/post/kashmir-prisoner-jail-public-safety-act-covid-19
WIRE-466626,"Assam: Despite Bail Order, SMSS Leader Manas Konwar Denied Release",2020-07-13T23:00:35+05:30,https://thewire.in/post/smss-leader-manas-konwar-bail-jail-authorities
WIRE-466374,"Chained Muse: Notes from Prison by Varavara Rao",2020-07-13T15:53:15+05:30,https://thewire.in/post/chained-muse-notes-from-prison-varavara-rao-bhima-koregaon
WIRE-466434,"Prometheus Unbound: India Must Look to the Farmer for Way Forward",2020-07-13T14:15:14+05:30,https://thewire.in/post/coronavirus-lockdown-economy-agriculture-way-forward
WIRE-466422,"Court Refuses to Allow 2008 Ahmedabad Blast Accused to Contact Families During Pandemic",2020-07-13T13:30:17+05:30,https://thewire.in/post/ahmedabad-court-jail-2008-blast-accused
WIRE-466402,"Akhil Gogoi: 100 Writers Demand Proper Treatment For COVID-19 Positive Leader in Jail",2020-07-13T13:10:40+05:30,https://thewire.in/post/akhil-gogoi-covid-positive-jail-writers-letter
WIRE-466391,"Watch | COVID-19 Bulletin: Nearly 30,000 Cases Reported for the Second Consecutive Day",2020-07-13T10:45:36+05:30,https://thewire.in/post/watch-covid-19-bulletin-nearly-30000-cases-reported-for-the-second-consecutive-day
WIRE-466254,"Tom Hanks' 'Greyhound' Reflects COVID-19's Impact on the Film Industry",2020-07-13T07:00:08+05:30,https://thewire.in/post/tom-hanks-greyhound-reflects-covid-19s-impact-on-the-film-industry
WIRE-466351,"'No Reason in Law or Conscience to Hold Varavara Rao', Say Academics in Appeal",2020-07-12T21:00:07+05:30,https://thewire.in/post/varavara-rao-release-appeal-academics
WIRE-466215,"As Varavara Rao's Health Worsens in Jail, Family Alleges Severe Negligence by Authorities",2020-07-12T17:00:46+05:30,https://thewire.in/post/as-varavara-raos-health-worsens-in-jail-family-alleges-severe-negligence-by-authorities
WIRE-466261,"Jammu: Poor Facilities at Quarantine Centre Force People to Slip Away",2020-07-12T15:00:20+05:30,https://thewire.in/post/jammu-poor-facilities-at-quarantine-centre-force-people-to-slip-away
WIRE-466269,"COVID-19: India Reports Another Record Spike as Tally Approaches 8.5 Lakh",2020-07-12T14:33:25+05:30,https://thewire.in/post/covid-19-india-reports-another-record-spike-as-tally-approaches-8-5-lakh
WIRE-466221,"Akhil Gogoi Tests Positive for COVID-19 in Jail; 'What Tests Did They Do?' Asks Family",2020-07-12T00:32:34+05:30,https://thewire.in/post/akhil-gogoi-covid-19-positive-jail
WIRE-466210,"Karnataka: One-Week Lockdown in Bengaluru Urban, Rural From July 14",2020-07-11T21:50:22+05:30,https://thewire.in/post/covid-19-lockdown-karnataka-bengaluru-urban-rural
WIRE-466166,"BJP Prevents Parliamentary Panel From Scrutinising PM-CARES Fund",2020-07-11T18:36:36+05:30,https://thewire.in/post/bjp-prevents-parliamentary-panel-from-scrutinising-pm-cares-fund
WIRE-466120,"Why Did Telangana Under KCR Lose the Plot Against COVID-19?",2020-07-11T16:04:27+05:30,https://thewire.in/post/covid-19-kcr-telangana-policy-testing
WIRE-466097,"Narendra Modi Is Not Creating the India That Returning Indians Will Want to Live in",2020-07-11T14:41:00+05:30,https://thewire.in/post/narendra-modi-india-diaspora-liberal
WIRE-466074,"COVID-19: A Summer of Struggle and Innovation for Educators",2020-07-11T13:44:01+05:30,https://thewire.in/post/covid-19-school-education-teachers
WIRE-466067,"COVID-19: Record 27,114 Cases in One Day, India's Tally Crosses 8-Lakh Mark",2020-07-11T13:22:58+05:30,https://thewire.in/post/covid-19-cases-single-day-record-total-deaths-updates
WIRE-466076,"Watch: How Essential Workers Are Braving COVID-19, Ensuring Supplies and Doing Their Jobs",2020-07-11T12:59:58+05:30,https://thewire.in/post/watch-how-essential-workers-are-braving-covid-19-ensuring-supplies-and-doing-their-jobs
WIRE-466064,"Goa: All Colvale Central Jail Prisoners to be Tested as Jailor Found COVID-19 Positive",2020-07-11T12:21:17+05:30,https://thewire.in/post/all-jail-inmates-to-be-tested
WIRE-465976,"Ghislaine Maxwell Seeks Bail and Denies Jeffrey Epstein-Related Charges",2020-07-11T12:15:44+05:30,https://thewire.in/post/ghislaine-maxwell-seeks-bail-and-denies-jeffrey-epstein-related-charges
WIRE-466052,"Why Malaysia Is Angry With an Al Jazeera Documentary on Undocumented Migrants",2020-07-11T12:12:08+05:30,https://thewire.in/post/malaysia-al-jazeera-migrants-documentary
WIRE-465888,"How Meaningful Are Some Estimates for India's Coal Consumption Data?",2020-07-10T19:00:21+05:30,https://thewire.in/post/how-meaningful-are-some-estimates-for-indias-coal-consumption-data
WIRE-465845,"SC Pulls Up Maharashtra Govt for Claiming Everything 'Fine' on Migrant Crisis",2020-07-10T14:47:46+05:30,https://thewire.in/post/covid-19-lockdown-migrant-workers-maharashtra-supreme-court
WIRE-465890,"India's COVID-19 Cases Near the 8 Lakh Mark, Friday Sees Another Record Daily Spike",2020-07-10T14:05:10+05:30,https://thewire.in/post/indias-covid-19-cases-near-the-8-lakh-mark-friday-sees-another-record-daily-spike
WIRE-465741,"West Bengal: Total Lockdown in Containment Zones as COVID-19 Cases Surge",2020-07-10T12:21:56+05:30,https://thewire.in/post/lockdown-in-west-bengal-as-cases-rise
WIRE-465806,"Watch | COVID-19 Updates: Health Ministry Briefs Country After Nearly 30 Days",2020-07-10T11:20:26+05:30,https://thewire.in/post/covid-19-updates-health-ministry-briefing
WIRE-465803,"Bombay High Court Orders a COVID-19 Patient to Return to Prison",2020-07-10T11:00:44+05:30,https://thewire.in/post/bombay-high-court-covid-19-patient-return-prison
WIRE-465745,"Nizamuddin Markaz: 60 Malaysians Walk Free, Fined Rs 7,000 by Delhi HC",2020-07-09T23:57:07+05:30,https://thewire.in/post/nizamuddin-markaz-60-malaysians-walk-free-fined-rs-7000-by-delhi-hc
WIRE-465770,"Centre Tells SC Creation of PM-CARES Justified, Opposes Transfer of Contributions to NDRF",2020-07-09T22:47:31+05:30,https://thewire.in/post/centre-pm-cares-supreme-court-ndrf
WIRE-465755,"Assam: Officials Refuse to Confirm Whether Akhil Gogoi Tested Positive for COVID-19",2020-07-09T19:23:25+05:30,https://thewire.in/post/akhil-gogoi-covid-19-jail
WIRE-465637,"COVID-19 Uncertainty Causing Rise in Forced Savings, Slow Spending: UBS",2020-07-09T15:42:25+05:30,https://thewire.in/post/covid-19-economy-forced-savings-spending-ubs-report
WIRE-464766,"We Need to Consider Nationalising Private Hospitals if We Are to Avert a Total Disaster",2020-07-09T15:08:47+05:30,https://thewire.in/post/we-need-to-consider-nationalising-private-hospitals-if-we-are-to-avert-a-total-disaster
WIRE-465611,"Government Calls Off Merger of Three Ailing Public Sector General Insurers",2020-07-09T14:40:31+05:30,https://thewire.in/post/merger-of-3-insurance-firms-called-off
WIRE-465643,"A COVID Miracle: Brazil's Bolsonaro Loves to Deny the Virus but Pushes a Cure",2020-07-09T14:30:05+05:30,https://thewire.in/post/bolsonaro-covid-19-miracle-denial
WIRE-465630,"Bengaluru: 7-Year-Old's Final Rites on Hold as Family Forced to Wait for COVID-19 Test Result",2020-07-09T13:00:38+05:30,https://thewire.in/post/bengaluru-final-rites-boy-covid-test
WIRE-465618,"Watch | Media Bol: Deaths, Despair and Increasing Unemployment in the Media",2020-07-09T12:54:05+05:30,https://thewire.in/post/watch-media-bol-deaths-despair-and-increasing-unemployment-in-the-media
WIRE-465584,"Gujarat HC Grants Bail to 15 Migrants Held During Rajkot Protest in May",2020-07-09T12:07:49+05:30,https://thewire.in/post/hc-grants-bail-migrant-workers
WIRE-465576,"Watch | COVID-19 Bulletin: In a First, Over 26,000 New Cases Recorded in India",2020-07-09T11:15:33+05:30,https://thewire.in/post/watch-covid-19-bulletin-in-a-first-over-26000-new-cases-recorded-in-india
